{
  "surum": 1,
  "adim": "baslik",
  "notlar": [
    "Bütün kanıtlar veri_ozeti_30a.md (paket 3a8b1fc1) içindendir. Bu çalışmada mahalle özeti verilmediği için iki mahalle adayı (Seaside, Rosemary Beach) da 30A özetindeki mahalle satırlarıyla planlandı; mahalle-rehberi paketi kurulunca restoran saatleri ve erişim ayrıntıları eklenecek.",
    "Programda yalnız iki şablon var (ilk-video, mahalle-rehberi). 11 adayın 8'i yeni şablon gerektiriyor. Önerilen öncelik: plaj erişimi, haftalık maliyet ve en iyi ay; araştırmada üçü de rakiplerin boş bıraktığı ve izleyicinin en çok sorduğu konular.",
    "Plaj erişimi hukukuna dayanan her aday (K0069–K0082) yayından önce yeniden kontrol edilmeli; 10 Ekim 2026'dan sonraki bir ilçe kararı K0082 özetini değiştirebilir. K0081 hiçbir başlıkta ve planda kullanılmadı; 'özel plaj kalmadı' denmez.",
    "‘Kendi tarihsel verimizden videolar’ ailesinden aday yok: elimizde kiralama fiyatlarının tek bir anlık görüntüsü (Ekim 2026) var; fiyatın zaman içinde nasıl değiştiğini gösterecek seri henüz birikmedi.",
    "Erişilebilirlik (K0821–K0834) ve Alys Beach ayrı video olarak önerilmedi: erişilebilirlik verisi 15–17 dakikayı taşımıyor, ilk-video ve plaj erişimi videolarının içinde kalmalı; Alys Beach fiyatları tek şirketin kendi envanterinden geldiği ve Book>Direct'te yalnız 7 ilan göründüğü için şimdilik ayrı rehber zayıf kalır.",
    "Restoran özetinde mahalle sayılarının toplamı 141, bilinen boşluklar notu ise 138 restoran diyor; restoran ağırlıklı adaylardan önce bu fark kontrol edilmeli."
  ],
  "adaylar": [
    {
      "baslik_en": "30A Florida for First-Timers: Which Town, Which Month and What a Week Costs",
      "baslik_tr": "İlk kez 30A Florida'ya gidenler için: hangi kasaba, hangi ay ve bir hafta ne tutar",
      "bolge": "30A geneli",
      "aile": "Genel planlama",
      "neden_onerildi": "En çok izlenen 30A videosu genel bir ilk-kez rehberi (435 bin izlenme), ama rakiplerin hiçbiri fiyatı, sezonu ve plaj erişimini veriyle anlatmıyor. Kanalın açılış videosu olarak bütün ailelerin kapısını açar ve mevcut ilk-video şablonuyla hemen kurulabilir.",
      "izleyici_sorusu": "30A'ya ilk kez gidiyorum: hangi kasabada ve hangi ayda kalmalıyım, bir hafta ne tutar ve gitmeden neyi bilmeliyim?",
      "kanca": {
        "metin": "30A bir kasaba değil: FDOT'un yol envanterinde 18.561 millik bir ilçe yolu (CR 30A). Destin ve Fort Walton Beach ise Walton County'de bile değil. Bu yol boyunca resmî dizinde 13 mahalle var ve kiralama şirketlerinin sitelerinde sorduğumuz bir haftanın ortancası Ocak'ta Seagrove'da yaklaşık $1,885'ten Temmuz'da WaterColor'da yaklaşık $10,765'e çıkıyor.",
        "kanitlar": [
          {"dosya": "veri_ozeti_30a.md", "kimlik": "K0001"},
          {"dosya": "veri_ozeti_30a.md", "kimlik": "K0002"},
          {"dosya": "veri_ozeti_30a.md", "kimlik": "K0006"},
          {"dosya": "veri_ozeti_30a.md", "kimlik": "K0364"},
          {"dosya": "veri_ozeti_30a.md", "kimlik": "K0346"}
        ]
      },
      "icerik_plani": [
        {
          "bolum": "30A nedir ve nerededir",
          "ne_anlatir": "30A'nın bir ilçe yolu olduğu, Walton County içindeki yeri, Destin ve Fort Walton Beach'in başka ilçede olduğu; Visit South Walton'ın 16 mahallesinden programın 13'ü kapsadığı.",
          "kanitlar": [
            {"dosya": "veri_ozeti_30a.md", "kimlik": "K0001"},
            {"dosya": "veri_ozeti_30a.md", "kimlik": "K0002"},
            {"dosya": "veri_ozeti_30a.md", "kimlik": "K0003"},
            {"dosya": "veri_ozeti_30a.md", "kimlik": "K0006"}
          ]
        },
        {
          "bolum": "13 mahalle tek bakışta",
          "ne_anlatir": "Resmî dizinin etiketleri, Temmuz 2027 aramasında görünen ilan sayıları (tarih ve pencere söylenerek) ve mahalleye düşen halka açık erişim sayısıyla mahallelerin karakteri.",
          "kanitlar": [
            {"dosya": "veri_ozeti_30a.md", "kimlik": "K0007"},
            {"dosya": "veri_ozeti_30a.md", "kimlik": "K0013"},
            {"dosya": "veri_ozeti_30a.md", "kimlik": "K0018"},
            {"dosya": "veri_ozeti_30a.md", "kimlik": "K0027"},
            {"dosya": "veri_ozeti_30a.md", "kimlik": "K0030"},
            {"dosya": "veri_ozeti_30a.md", "kimlik": "K0033"}
          ]
        },
        {
          "bolum": "Plaj erişiminin gerçeği",
          "ne_anlatir": "Islak kumun herkese açık olduğu, halka açık erişim listesinde Seaside, WaterColor, Alys ve Rosemary'de nokta olmadığı, bugünkü hukuki durumun K0082'deki özet kadarıyla anlatılması.",
          "kanitlar": [
            {"dosya": "veri_ozeti_30a.md", "kimlik": "K0056"},
            {"dosya": "veri_ozeti_30a.md", "kimlik": "K0041"},
            {"dosya": "veri_ozeti_30a.md", "kimlik": "K0042"},
            {"dosya": "veri_ozeti_30a.md", "kimlik": "K0048"},
            {"dosya": "veri_ozeti_30a.md", "kimlik": "K0049"},
            {"dosya": "veri_ozeti_30a.md", "kimlik": "K0082"}
          ]
        },
        {
          "bolum": "Hangi ay: hava, deniz ve kasırga",
          "ne_anlatir": "Destin havalimanı 1991–2020 normalleri, Panama City Beach istasyonunun deniz suyu ortalamaları ve 1991–2025 kasırga sayımı; dönemler ve istasyonlar açıkça söylenir.",
          "kanitlar": [
            {"dosya": "veri_ozeti_30a.md", "kimlik": "K0129"},
            {"dosya": "veri_ozeti_30a.md", "kimlik": "K0132"},
            {"dosya": "veri_ozeti_30a.md", "kimlik": "K0183"},
            {"dosya": "veri_ozeti_30a.md", "kimlik": "K0192"},
            {"dosya": "veri_ozeti_30a.md", "kimlik": "K0195"},
            {"dosya": "veri_ozeti_30a.md", "kimlik": "K0206"}
          ]
        },
        {
          "bolum": "Kalabalık ve okul tatilleri",
          "ne_anlatir": "Turist vergisi tahsilatının aylara dağılımı, mevsimlik doluluk ve en çok ziyaretçi gönderen şehirlerin okul tatil haftaları.",
          "kanitlar": [
            {"dosya": "veri_ozeti_30a.md", "kimlik": "K0217"},
            {"dosya": "veri_ozeti_30a.md", "kimlik": "K0211"},
            {"dosya": "veri_ozeti_30a.md", "kimlik": "K0224"},
            {"dosya": "veri_ozeti_30a.md", "kimlik": "K0228"},
            {"dosya": "veri_ozeti_30a.md", "kimlik": "K0233"},
            {"dosya": "veri_ozeti_30a.md", "kimlik": "K0234"}
          ]
        },
        {
          "bolum": "Bir hafta ne tutar",
          "ne_anlatir": "Seçilmiş mahallelerde Ocak ve Temmuz haftası için vergi ve ücret dahil 7 gecelik ortanca (ilan sayısı ve çeyreklerle) ve ilçenin yıllık ortalama günlük fiyatı.",
          "kanitlar": [
            {"dosya": "veri_ozeti_30a.md", "kimlik": "K0364"},
            {"dosya": "veri_ozeti_30a.md", "kimlik": "K0370"},
            {"dosya": "veri_ozeti_30a.md", "kimlik": "K0358"},
            {"dosya": "veri_ozeti_30a.md", "kimlik": "K0418"},
            {"dosya": "veri_ozeti_30a.md", "kimlik": "K0346"},
            {"dosya": "veri_ozeti_30a.md", "kimlik": "K0222"}
          ]
        },
        {
          "bolum": "Yemek",
          "ne_anlatir": "Mahalle başına restoran sayısı ve menülerden hesaplanan fiyat seviyesi aralığı (bizim sınıflamamız olarak).",
          "kanitlar": [
            {"dosya": "veri_ozeti_30a.md", "kimlik": "K0554"},
            {"dosya": "veri_ozeti_30a.md", "kimlik": "K0586"},
            {"dosya": "veri_ozeti_30a.md", "kimlik": "K0678"},
            {"dosya": "veri_ozeti_30a.md", "kimlik": "K0703"}
          ]
        },
        {
          "bolum": "Araba, market, acil sağlık ve havalimanı",
          "ne_anlatir": "Golf arabası kuralı, en yakın büyük süpermarket ve acil servise kuş uçuşu ortancalar ve üç havalimanının kuş uçuşu uzaklığı.",
          "kanitlar": [
            {"dosya": "veri_ozeti_30a.md", "kimlik": "K0790"},
            {"dosya": "veri_ozeti_30a.md", "kimlik": "K0738"},
            {"dosya": "veri_ozeti_30a.md", "kimlik": "K0711"},
            {"dosya": "veri_ozeti_30a.md", "kimlik": "K0766"},
            {"dosya": "veri_ozeti_30a.md", "kimlik": "K0778"},
            {"dosya": "veri_ozeti_30a.md", "kimlik": "K0779"}
          ]
        },
        {
          "bolum": "Plaj kuralları, güvenlik ve erişilebilirlik",
          "ne_anlatir": "Bayrak renkleri, cankurtaran saatleri, cam yasağı, ceza üst sınırı ve plaj tekerlekli sandalyesinin nerede bulunduğu.",
          "kanitlar": [
            {"dosya": "veri_ozeti_30a.md", "kimlik": "K0114"},
            {"dosya": "veri_ozeti_30a.md", "kimlik": "K0115"},
            {"dosya": "veri_ozeti_30a.md", "kimlik": "K0122"},
            {"dosya": "veri_ozeti_30a.md", "kimlik": "K0086"},
            {"dosya": "veri_ozeti_30a.md", "kimlik": "K0106"},
            {"dosya": "veri_ozeti_30a.md", "kimlik": "K0822"}
          ]
        },
        {
          "bolum": "Merak: planlı kasabalar nasıl doğdu",
          "ne_anlatir": "Seaside, Rosemary Beach ve Alys Beach'in planlanma tarihleri ve Truman Show bağlantısı; kapanışta mahalle videolarına köprü.",
          "kanitlar": [
            {"dosya": "veri_ozeti_30a.md", "kimlik": "K0837"},
            {"dosya": "veri_ozeti_30a.md", "kimlik": "K0839"},
            {"dosya": "veri_ozeti_30a.md", "kimlik": "K0840"},
            {"dosya": "veri_ozeti_30a.md", "kimlik": "K0841"}
          ]
        }
      ],
      "eksik_veri": [
        "Fiyatı okunamayan büyük kiralama şirketleri var (360blue 256, Cottage Rental Agency 82, RealJoy 61, Vrbo 52 ilan); haftalık ortancalar bu şirketleri içermiyor.",
        "Gulf Place fiyatları küçük örnek; Alys Beach fiyatları tek şirketin kendi envanteri ve diğer mahallelerle karşılaştırılmaz.",
        "Restoranların yaklaşık yarısında (72/138) fiyat seviyesi hesaplanamadı.",
        "Uçak bileti, araç kiralama, market ve bisiklet ya da golf arabası kiralama maliyeti yok.",
        "Havalimanı ve market mesafeleri kuş uçuşu; sürüş süresi ve trafik sıkışıklığı ölçümü yok."
      ],
      "sablon": "ilk-video",
      "parametreler": {},
      "yeni_sablon_gerekir": false,